métier,Compétences
Analyse et ingénierie financière (M1201),"analyser l'information financière, économique et géopolitique pouvant impacter l’investissement et les marchés.,réaliser les modèles de prévisions pour l'entreprise, le projet de restructuration ou le produit financier étudié,estimer la valeur de l'entreprise analysée et élaborer les conclusions,etablir les recommandations de cession d'actifs financiers à destination des opérateurs sur les marchés,concevoir le business plan, l'introduction en bourse, l'offre publique d'achat pour des instances dirigeantes de l'entreprise conseillée,etudier/identifier les risques de crédits, de marché, ... de l'entreprise et proposer des solutions de couverture,apporter un appui technique à des courtiers, des traders, des trésoriers, ...en matière de litiges ou d'arbitrage"
Audit et contrôle comptables et financiers (M1202),"définir ou mettre en oeuvre les méthodes et procédures en matière de contrôle comptable, veiller à leur application et proposer des améliorations,elaborer et mettre en oeuvre le plan d'audit annuel d'une structure ou déterminer et superviser les missions d'audit,préparer les éléments nécessaires à un audit, les transmettre au commissaire aux comptes, au contrôleur de gestion, ... ou les analyser,contrôler la régularité, la fiabilité des opérations réalisées et des états financiers des structures,identifier et révéler les irrégularités ou les inexactitudes repérées lors d'enquêtes ou de vérifications"
Comptabilité (M1203),"vérifier et valider les éléments constitutifs des payes, de la facturation et des mandatements,procéder à la réglementation et à la saisie des factures, des mandats, des titres et effectuer le rapprochement bancaire,réaliser le suivi de la trésorerie et en valider la fiabilité,etablir et effectuer les déclarations fiscales et sociales légales,actualiser le paramétrage des systèmes de traitement des données comptables (taux de cotisation sociales, ...),etablir les états financiers,coordonner entre les différents services internes et externes (auditeurs et autorités)"
Contrôle de gestion (M1204),"définir et mettre en place les indicateurs et les procédures de suivi de l'activité de la structure,analyser les performances de la structure, contrôler les résultats financiers et préconiser des actions correctives,effectuer le suivi budgétaire et superviser les clôtures comptables, les opérations d'inventaire,conduire ou mettre en place le contrôle interne de la structure,réaliser le reporting auprès des instances dirigeantes et proposer des solutions d'optimisation de rentabilité de la structure,apporter un appui technique (conseil en gestion, études de coûts, ...) sur la réalisation d'économies"
Direction administrative et financière (M1205),"définir et mettre en place les procédures de gestion administrative et financière et les indicateurs nécessaires au suivi d'activité et au reporting à la direction,elaborer le budget prévisionnel de la structure, le présenter aux instances dirigeantes et effectuer les ajustements,suivre l'évolution des résultats financiers de la structure et établir son plan de financement,superviser, contrôler la gestion de la trésorerie et émettre des recommandations sur l'allocation des ressources financières aux instances dirigeantes,superviser et coordonner l'audit interne (évaluation des risques financiers, validation de choix fiscaux, ...),superviser et coordonner l'action des services, des conseils juridiques en matière de litige et de montages financiers"
Management de groupe ou de service comptable (M1206),"effectuer la gestion comptable et administrative d'une structure,etablir les déclarations fiscales et sociales d'une structure ou effectuer le suivi des enregistrements, des formalités légales, ...,procéder à l'établissement des situations intermédiaires, annexes comptables et financières du tableau de bord économique de la structure,elaborer le bilan et établir le compte de résultat de la structure,réaliser la tenue de la trésorerie, produire les états financiers et établir les prévisions de trésorerie,développer et maintenir les relations avec le commissaire aux comptes, les banques, pour les emprunts, les placements financiers, le crédit d'impôts, ..."
Trésorerie et financement (M1207),"suivre les positions de trésorerie et en contrôler la prise en compte comptable,etablir la trésorerie prévisionnelle dans le respect des ratios financiers d'endettement, de solvabilité, de fond de roulement,elaborer le budget de trésorerie selon les éléments comptables et financiers de l'entreprise et l'historique de son activité,déterminer les besoins en financement ou les disponibilités financières de la structure et mettre en place les actions adaptées (ligne de crédit, investissement, ...),evaluer les flux financiers entrants ou sortants de la structure et en définir les procédures de traitement et de sécurisation,détecter les fragilités financières de la structure et émettre des recommandations de gestion"
Direction de grande entreprise ou d'établissement public (M1301),"définir la politique générale (organisation, développement économique, ...) et les orientations financières de la structure,définir et superviser la politique de gestion des ressources humaines de la structure,superviser les directions stratégiques de la structure et organiser des échanges avec l'équipe de direction,suivre et analyser les données d'activité du service ou de la structure et proposer des axes d'évolution,mener des actions de communication/représentation auprès des acteurs de l'environnement socio-économique"
Direction de petite ou moyenne entreprise (M1302),"définir et décliner les orientations stratégiques d'une structure,organiser et mettre en place les modalités de fonctionnement de la structure,superviser la gestion des ressources humaines d'une structure (paie, formation, recrutement, ...),gérer les moyens budgétaires et matériels de la structure ou planifier les opérations financières,suivre et analyser les données d'activité du service ou de la structure et proposer des axes d'évolution,communiquer les informations sur les résultats d'activité, les évolutions, les enjeux en interne ou à des partenaires,définir l'objectif de rentabilité économique de la structure"
Conduite d'enquêtes (M1401),"identifier les personnes cibles, les informer sur la nature et le déroulement de l'enquête,guider la personne tout au long de l'enquête et réceptionner les données,compléter les formulaires, les questionnaires et les compte rendus,effectuer le classement des données collectées et transmettre les résultats de l'enquête"
Conseil en organisation et management d'entreprise (M1402),"analyser les besoins du client et définir les objectifs et le cadre de l'intervention,présenter des solutions au client et préconiser des améliorations en matière d'organisation, de procédures, d'outils,...,définir les modalités de mise en oeuvre des solutions retenues et identifier les indicateurs de suivi,accompagner le client dans la mise en oeuvre des solutions retenues et le conseiller sur l'organisation, les méthodes et les outils,suivre et mettre à jour l'information technique, économique, règlementaire, ..."
Études et prospectives socio-économiques (M1403),"définir les méthodes et les outils de traitement de l'information en fonction des moyens, coûts, délais, organisation, ...,rechercher les sources d'information économique, technologique, juridique, concurrentielle, ...,sélectionner les informations et les données (rapports, documentations, médias, enquêtes, ...),adapter les outils de traitement statistique de données, réaliser des études et formaliser les résultats,rédiger l'information produite (études, synthèses, rapports, bulletins, ...) et établir des prévisions, des évaluations, des recommandations, des perspectives, ...,présenter et diffuser les résultats des études réalisées"
Assistanat en ressources humaines (M1501),"suivre et mettre à jour les dossiers individuels des salariés et réaliser les déclarations réglementaires,collecter les besoins en formation du personnel et en réaliser une synthèse,elaborer et actualiser les supports de suivi et de gestion des ressources humaines (tableaux de bord sociaux, grilles de salaires, plannings des congés, ...),renseigner le personnel sur la législation sociale et les spécificités de la structure,mettre en place les élections des représentants du personnel,suivre le traitement des mesures disciplinaires et des relations avec les instances légales (inspection du travail, conseil des prud'hommes, ...),accueillir les nouveaux salariés et favoriser leur intégration dans la structure"
Développement des ressources humaines (M1502),"analyser les besoins de l'entreprise en formation, en recrutement et en mobilité professionnelle,déterminer et suivre le budget nécessaire à la mise en oeuvre de la politique de management et de développement des compétences de la structure,elaborer et mettre en oeuvre les plans de développement des compétences, la gestion de l'emploi et la mobilité professionnelle,organiser le suivi administratif des opérations de formation ou de recrutement,conseiller et accompagner les personnes, les services et les entreprises dans l'analyse des besoins en développement des ressources humaines,communiquer sur le management des emplois et des compétences avec les salariés, les représentants du personnel, ..."
Management des ressources humaines (M1503),"elaborer la politique de management des ressources humaines selon les orientations stratégiques de la structure et définir les plans d'action,concevoir et piloter les opérations liées à la gestion des emplois et des compétences,organiser la concertation et le dialogue social avec les membres du personnel ou leurs représentants,contrôler la conformité d'application des obligations légales et réglementaires et mettre en place les actions appropriées,superviser la gestion administrative du personnel,elaborer ou faire évoluer les procédures, les supports de suivi et de gestion du personnel de la structure,suivre et mettre à jour les informations professionnelles et réglementaires"
Opérations administratives (M1602),"procéder à l'enregistrement, au tri, à l'affranchissement du courrier,réaliser des opérations de saisie de courrier, de tableaux, ... selon les consignes,constituer les dossiers administratifs et contrôler les données, leur mise à jour, les retours ou les relances"
Assistanat de direction (M1604),"organiser les rendez vous, le planning d'un responsable, d'un collaborateur et filtrer les appels et les accueils physiques,concevoir et rédiger des courriers, rapports, notes, ...,traiter et transmettre les décisions, les notes de service, les contrats en interne et en externe,organiser les déplacements du responsable ou de membres de l'équipe,préparer et organiser les réunions (convocations, préparation des dossiers, réservation de salles, ...),effectuer la frappe de documents, le traitement du courrier et la gestion des messages électroniques"
Assistanat technique et administratif (M1605),"participer au lancement d'appels d'offres (rédaction, émissions d'annonces officielles, ...) et au suivi des candidatures,constituer et saisir des dossiers de candidature de l'entreprise à un appel d'offres et en effectuer le suivi,concevoir et actualiser les outils de suivi d'activité de la structure au moyen de tableaux de bord, d'échéanciers, ...,organiser les réunions du groupe projet ou de la structure et rédiger les comptes rendus,renseigner les clients, les commanditaires sur l'avancée de leur dossier et transmettre les procès verbaux, l'état d'avancement, les échéanciers,effectuer le suivi comptable et budgétaire de l'entité par des opérations de facturation, de déblocage de fonds, de relance de financeurs, de saisie d'écritures comptables,saisir et mettre en forme les documents, les transmettre et les classer"
Secrétariat comptable (M1608),"effectuer l'accueil téléphonique et la réception des clients et les renseigner ou les orienter,saisir les données de comptabilité générale et enregistrer les écritures comptables,renseigner les déclarations fiscales (taxe sur la valeur ajoutée -tva, déclarations sociales).,suivre les éléments de la trésorerie de la structure par rapprochement bancaire, vérification des frais généraux et des factures, ...,elaborer les documents commerciaux et réaliser les opérations liées au recouvrement avec le suivi des paiements, la relance des impayés,effectuer les recherches documentaires en lien avec l'activité de la structure ou du service et les transmettre ou les archiver,saisir et mettre en forme les documents, les transmettre et les classer"
Administration des ventes (M1701),"définir les procédures administratives de traitement des commandes et en contrôler l'application,coordonner l'activité du service, analyser les supports de suivi d'activité et proposer des axes d'évolution,contrôler ou enregistrer les contrats de vente et informer le client sur le traitement de sa commande,participer à l'élaboration du planning de production selon les informations recueillies auprès des clients et des services internes,etablir la planification de traitement des commandes et déclencher l'ordre de production ou le transmettre au service concerné,suivre l'état d'avancement de la fabrication des produits et proposer des actions correctives,organiser l'expédition des commandes et informer les clients sur la mise à disposition des produits,contrôler le suivi administratif de comptes clients (avoirs, escomptes, encours, ...) et superviser la gestion de portefeuilles (dossiers de financement, solvabilité, ...),traiter des dossiers particuliers (litiges, ...) ou transmettre au service concerné,participer aux actions de gestion de ressources humaines (recrutement, formation, ...)"
Analyse de tendance (M1702),"collecter les tests, enquêtes, observations sur un produit, un service, une marque, des usages ou des comportements,analyser le produit, le service, la marque et déterminer son positionnement sur le marché,analyser les comportements, les usages et l'environnement social, professionnel, culturel de consommateurs, de clients,détecter et évaluer les évolutions du marché, de tendances, d'usages, de comportements de consommateurs et clients ou l'émergence de nouveaux marchés,etablir le cahier de tendances ou les propositions de projets à partir des analyses et études,suivre et mettre à jour l'information culturelle, réglementaire, professionnelle"
Management et gestion de produit (M1703),"analyser le marché des produits, les besoins des consommateurs et de la concurrence,définir les caractéristiques de nouveaux produits, l'adaptation de produits existants,etablir les modalités de fabrication des produits selon les impératifs de production,consulter et sélectionner les fournisseurs, les sous-traitants, les prestataires,réaliser le plan marketing du produit ou de la gamme après élaboration du cahier des charges technique,analyser les parts de marché, ventes, marges bénéficiaires du produit ou de la gamme et proposer des ajustements (opérations de promotion, alignement sur la concurrence, ...),concevoir le plan média de mise sur le marché du produit ou de la gamme et les supports de promotion (fiche technique, argumentaire de vente, catalogue, ...),apporter un appui technique au réseau commercial sur le produit ou la gamme (caractéristiques techniques, innovation, ...)"
Management relation clientèle (M1704),"elaborer ou participer à l'élaboration de la stratégie relation clientèle et déterminer les plans d'actions annuels et les objectifs du service,elaborer ou faire évoluer les procédures qualité du service clientèle et en contrôler l'application,concevoir les indicateurs de performance du service, analyser les résultats et mettre en place des ajustements,renseigner les supports de suivi d'activité, réaliser le bilan annuel d'activité et proposer des axes d'évolution,coordonner l'activité d'une équipe,recueillir les remarques de la clientèle et les transmettre au service de production, marketing, recherche, développement, ...,proposer des solutions en réponse aux réclamations de la clientèle ou transmettre le dossier au service contentieux, logistique, ...,participer aux actions de gestion de ressources humaines (recrutement, formation, ...)"
Marketing (M1705),"elaborer la stratégie marketing de l'entreprise selon l'étude de marché,elaborer le plan marketing et contrôler le déploiement des opérations,elaborer et suivre les éléments du budget marketing pour l'ensemble des produits de l'entreprise,concevoir la campagne promotionnelle des produits et la mettre en oeuvre,concevoir les supports de promotion des produits et en vérifier l'application,réaliser le bilan des actions marketing et proposer des axes d'évolution,apporter un appui technique aux commerciaux lors des plans d'actions commerciales"
Promotion des ventes (M1706),"analyser les informations sur un produit ou une gamme et définir le type de campagne promotionnelle,concevoir la campagne promotionnelle du produit ou de la gamme et déterminer les caractéristiques des supports publicitaires,elaborer le budget de la campagne promotionnelle du produit ou de la gamme et le gérer,organiser la mise en oeuvre de la campagne promotionnelle (logistique, négociation avec les enseignes, ...) et en suivre le déroulement,former l'équipe de commerciaux sur les produits et apporter un appui technique lors du lancement de la campagne promotionnelle,analyser les résultats de la campagne promotionnelle (atteinte des objectifs, ...) et proposer des axes d'évolution"
Stratégie commerciale (M1707),"elaborer la stratégie commerciale de l'entreprise et définir les plans d'actions annuels (promotion des produits, marchés à investir, ...),elaborer et gérer les budgets,organiser la force commerciale de l'entreprise (déploiement du réseau, formations commerciales, ...),participer et/ou mener les actions de gestion de ressources humaines (recrutement, formation, ...),concevoir le circuit de l'information du service commercial (réunions, notes, directives, ...) et échanger des informations avec les commerciaux,coordonner l'activité des commerciaux et leur apporter un appui technique,suivre et analyser les données d'activité du service ou de la structure et proposer des axes d'évolution,réaliser le suivi des clients grands comptes de la structure et analyser le potentiel de clients/prospects,réaliser la veille concurrentielle des produits (marché, prix, nouvelles tendances, ...)"
Administration de systèmes d'information (M1801),"suivre et actualiser la configuration et l'architecture des systèmes d'informations en fonction des évolutions,mettre en place les procédures techniques d'exploitation, d'utilisation et de sécurité des équipements informatiques,analyser les performances du système d'information et préconiser des mesures d'amélioration de la qualité, la sécurité, la productivité,définir et suivre les droits d'accès en fonction des caractéristiques des utilisateurs ou des services,identifier, diagnostiquer les dysfonctionnements, incidents, non-conformités et mettre en oeuvre les mesures correctives,sélectionner ou installer les équipements informatiques (logiciel, matériel, ...),conseiller et assister les équipes de développement, de production informatique ou utilisateurs dans le choix et la mise en oeuvre de solutions techniques,suivre et mettre à jour l'information technique, économique, règlementaire, ..."
Expertise et support en systèmes d'information (M1802),"analyser les besoins fonctionnels de l'entreprise, du client et définir les caractéristiques techniques du produit selon le cahier des charges,élaborer les solutions techniques et proposer les configurations ou les architectures à mettre en oeuvre, les évaluer et proposer les choix adaptés aux besoins fonctionnels,procéder aux phases de tests et de recettes des applications développées et en rédiger les documentations,informer ou former les équipes informatiques sur les aspects techniques (fonctionnement, sécurité, risques, ...) et sur l'exploitation de nouveaux équipements,définir et mettre en oeuvre les normes, standards, méthodes, outils et procédures (qualité, sécurité, ...) de fiabilisation, d'études ou de productions informatiques,conseiller et apporter une assistance technique à des utilisateurs, clients, services,suivre et mettre à jour l'information technique, économique, règlementaire, ...,planifier, mettre en oeuvre et intégrer des infrastructures informatiques nécessaires à la bonne exploitation des données"
Direction des systèmes d'information (M1803),"analyser et définir les besoins de l'entreprise, des utilisateurs en matière d'organisation et de systèmes d'information et de télécoms,elaborer le schéma directeur à partir des orientations fixées par la direction et des besoins des services utilisateurs et superviser les modalités de mise en oeuvre,gérer le budget global de la structure, du service ou du projet (investissement, affectations, répartitions, ...),superviser et coordonner la réalisation de projets,procéder au choix de réalisation, de traitement en interne ou par sous-traitance et en contrôler la conformité de réalisation,définir et contrôler l'application des procédures qualité et sécurité des systèmes d'information et de télécoms,diriger un service, une structure,suivre et mettre à jour l'information technique, économique, règlementaire, ..."
Études et développement de réseaux de télécoms (M1804),"recueillir et définir les besoins de l'entreprise, des clients, des utilisateurs en matière de systèmes télécoms (capacité, fiabilité, sécurité, ...),elaborer le projet d'architecture d'un réseau télécoms (maquette technique, évaluation économique, modélisation, définition, ...),définir et élaborer les spécifications fonctionnelles et techniques d'un réseau, d'équipements télécoms (matériel, logiciel, implantation, ...),déterminer des composants d'architecture, des technologies, des équipements, des outils supports et les intégrer selon les spécifications,définir et contrôler les procédures, les protocoles d'essais, de tests ou de validation de réseaux télécoms,dimensionner, planifier et suivre la capacité du réseau télécoms et de ses interconnexions,analyser les conditions de fonctionnement et d'utilisation et mettre en place des solutions d'ajustements, d'évolutions ou de migrations de réseaux et de ressources,suivre et mettre à jour l'information technique, économique, règlementaire, ..."
Études et développement informatique (M1805),"analyser les besoins du client, de l'utilisateur et constituer le cahier des charges fonctionnel (spécifications, délais, coûts, ...),elaborer et rédiger les spécifications techniques (cahier des charges technique) de l'application informatique,réaliser un prototype de la solution technique pour validation par le donneur d'ordres (configuration type, ...),concevoir et développer les programmes et applications informatiques,définir et réaliser les phases et procédures de tests techniques et fonctionnels de programmes et applications informatiques (planification, validation, ...),analyser les problèmes techniques, fonctionnels et proposer des correctifs, mises en conformité techniques, ...,elaborer et rédiger les documents et supports techniques à destination des développeurs, des utilisateurs, des services informatiques, ...,suivre et mettre à jour l'information technique, économique, règlementaire, ..."
Conseil et maîtrise d'ouvrage en systèmes d'information (M1806),"recueillir les besoins du commanditaire, analyser les processus métier et en évaluer l'opportunité et la faisabilité,formaliser et définir les solutions fonctionnelles à mettre en oeuvre, présenter les évolutions et extensions fonctionnelles du système d'information au commanditaire,etablir, rédiger les cahiers des charges, les spécifications fonctionnelles, générales et les transmettre à la maîtrise d'oeuvre,réaliser et suivre la mise en oeuvre des tests fonctionnels des applications développées,procéder à la mise en oeuvre des préconisations fonctionnelles, techniques et effectuer le déploiement des applications (paramétrage, suivi, ...),rédiger les supports d'information ou de formation et les communiquer aux personnes concernées,accompagner ou former les utilisateurs aux nouveaux processus métier et applications,suivre et mettre à jour l'information technique, économique, règlementaire, ..."
Exploitation de systèmes de communication (M1807),"contrôler le fonctionnement des équipements, des systèmes et vecteurs d'information,surveiller la performance, la capacité, la qualité du réseau et adapter les équipements, systèmes et vecteurs d'informations,rechercher ou recueillir les données, signaux, mesures, images, transmis ou émis et les identifier,contrôler et traiter les informations recueillies ou collectées ou les transmettre,identifier les anomalies électriques, électroniques, informatiques et appliquer les mesures correctives,effectuer l'entretien et la maintenance de premier niveau des équipements, des systèmes et vecteurs d'information,renseigner les personnels, les institutionnels, ... sur les interventions et les évolutions de la situation"
