métier,Compétences
Production et exploitation de systèmes d'information (M1810),"ordonnancer le déroulement des travaux et mettre en oeuvre les traitements d'exploitation/production des ressources informatiques,superviser et vérifier l'état des ressources informatiques, réaliser les sauvegardes et les archivages de données,contrôler et analyser le déroulement des travaux et le fonctionnement des systèmes, des réseaux, des outils et périphériques,identifier, diagnostiquer la nature et l'origine des incidents et mettre en oeuvre les mesures correctives,déclencher ou planifier les interventions de maintenance et contrôler la conformité des interventions,installer et intégrer le matériel (station, équipement réseau, périphériques, ...) dans l'environnement de production et configurer les ressources logiques et physiques,conseiller et apporter une assistance technique à des utilisateurs, clients, services,suivre et mettre à jour l'information technique, économique, règlementaire, ..."
Gestion des opérations de circulation internationale des marchandises (N1202),"informer et conseiller le client sur les formalités de circulation internationale des marchandises (dispositions légales, taxes, garanties, ...),codifier la marchandise à partir du descriptif fourni par le client,collecter les documents d'expédition de la marchandise et constituer le dossier de la prestation (transit, douane, ...),établir et contrôler les documents liés à la circulation internationale de la marchandise ( déclaration douanière, lettre de crédit, ...).,suivre l'acheminement des marchandises, informer le client sur le déroulement et présenter des solutions en cas d'anomalies"
Conception et organisation de la chaîne logistique (N1301),"elaborer et mettre en place les schémas d'organisation de l'activité logistique d'une structure (règles, modes opératoires, ...),concevoir les outils de pilotage des services achats, approvisionnements, expéditions et des sites (plate-formes, entrepôts, ...),organiser et synchroniser les activités logistiques selon les besoins du client et les contraintes du fournisseur,suivre la mise en place et la réalisation des plans d'action logistiques et contrôler la conformité d'application,déterminer les mesures correctives du circuit d'acheminement des produits en cas de dysfonctionnements,organiser et coordonner le circuit des informations et instructions de fonctionnement de la structure"
Direction de site logistique (N1302),"superviser la planification de l'exploitation du ou des sites logistiques en fonction de l'activité (flux internes/externes, commandes spécifiques, ...),superviser ou organiser l'activité des équipes logistiques (techniciens, chefs de quai, magasiniers, ...),suivre et analyser les données d'activité du service ou de la structure et proposer des axes d'évolution,organiser et coordonner le circuit des informations et instructions de fonctionnement de la structure,etablir et suivre les éléments du budget d'exploitation d'un ou plusieurs sites,elaborer et faire évoluer des procédures (réception, stockage, ...) et en contrôler l'application,superviser la gestion administrative du personnel,identifier et mettre en place des actions de gestion de ressources humaines"
Intervention technique d'exploitation logistique (N1303),"contrôler la réception des commandes et établir l'ordre de traitement,planifier l'activité des caristes et préparateurs de commandes, ... selon l'ordre de traitement des commandes,organiser la répartition des emplacements de stockage sur le site et en suivre la gestion,coordonner et contrôler les opérations logistiques de réception, expédition et livraison,organiser ou contrôler la gestion de stocks de produits, marchandises ou matières premières (référencement, rotation, ...),informer les clients internes ou externes sur le traitement et le suivi des commandes,renseigner les supports de suivi d'activité et identifier les écarts"
